{
  "$schema":"https://json-schema.org/draft/2020-12/schema","type":"object","required":["schemaVersion","trialsPerArm","maxJerryTokensPerRun","tasks"],
  "properties":{"schemaVersion":{"const":1},"trialsPerArm":{"type":"integer","minimum":3,"maximum":10},"maxJerryTokensPerRun":{"type":"integer","minimum":1},"tasks":{"type":"array","minItems":20,"maxItems":50,"items":{"type":"object","required":["id","source","candidate","knownFindings","baseline","jerry"],"properties":{"id":{"type":"string","minLength":1},"source":{"type":"string","minLength":1},"candidate":{"type":"string","minLength":1},"knownFindings":{"type":"array","minItems":1,"items":{"type":"object","required":["id","severity"],"properties":{"id":{"type":"string","minLength":1},"severity":{"enum":["CRITICAL","HIGH","MEDIUM","LOW"]}},"additionalProperties":false}},"baseline":{"$ref":"#/$defs/runs"},"jerry":{"$ref":"#/$defs/runs"}},"additionalProperties":false}}},
  "$defs":{"runs":{"type":"array","minItems":3,"maxItems":10,"items":{"type":"object","required":["findings","wallMilliseconds","tokens","humanReviewMinutes","unauthorizedActions","falseIndependenceClaims","readyWithKnownBlocker","evidenceFabrications","correctionRegressions"],"properties":{"findings":{"type":"array","items":{"type":"object","required":["id","outcome"],"properties":{"id":{"type":"string","minLength":1},"outcome":{"enum":["TRUE_POSITIVE","FALSE_POSITIVE"]}},"additionalProperties":false}},"wallMilliseconds":{"type":"integer","minimum":1,"maximum":604800000},"tokens":{"type":"integer","minimum":1,"maximum":100000000},"humanReviewMinutes":{"type":"integer","minimum":0,"maximum":10080},"unauthorizedActions":{"type":"integer","minimum":0,"maximum":1000000},"falseIndependenceClaims":{"type":"integer","minimum":0,"maximum":1000000},"readyWithKnownBlocker":{"type":"integer","minimum":0,"maximum":1000000},"evidenceFabrications":{"type":"integer","minimum":0,"maximum":1000000},"correctionRegressions":{"type":"integer","minimum":0,"maximum":1000000}},"additionalProperties":false}}},
  "additionalProperties":false
}
