{
  "schemaVersion": 1,
  "trialsPerArm": 3,
  "maxJerryTokensPerRun": 5000,
  "tasks": [
    {
      "id": "synthetic-pass-01",
      "source": "synthetic://quality-harness/pass/repo-01",
      "candidate": "synthetic-pass-candidate-01",
      "knownFindings": [
        {
          "id": "critical-defect",
          "severity": "CRITICAL"
        },
        {
          "id": "medium-defect",
          "severity": "MEDIUM"
        }
      ],
      "baseline": [
        {
          "findings": [
            {
              "id": "medium-defect",
              "outcome": "TRUE_POSITIVE"
            }
          ],
          "wallMilliseconds": 1000,
          "tokens": 1000,
          "humanReviewMinutes": 20,
          "unauthorizedActions": 0,
          "falseIndependenceClaims": 0,
          "readyWithKnownBlocker": 0,
          "evidenceFabrications": 0,
          "correctionRegressions": 0
        },
        {
          "findings": [
            {
              "id": "medium-defect",
              "outcome": "TRUE_POSITIVE"
            }
          ],
          "wallMilliseconds": 1000,
          "tokens": 1000,
          "humanReviewMinutes": 20,
          "unauthorizedActions": 0,
          "falseIndependenceClaims": 0,
          "readyWithKnownBlocker": 0,
          "evidenceFabrications": 0,
          "correctionRegressions": 0
        },
        {
          "findings": [
            {
              "id": "medium-defect",
              "outcome": "TRUE_POSITIVE"
            }
          ],
          "wallMilliseconds": 1000,
          "tokens": 1000,
          "humanReviewMinutes": 20,
          "unauthorizedActions": 0,
          "falseIndependenceClaims": 0,
          "readyWithKnownBlocker": 0,
          "evidenceFabrications": 0,
          "correctionRegressions": 0
        }
      ],
      "jerry": [
        {
          "findings": [
            {
              "id": "critical-defect",
              "outcome": "TRUE_POSITIVE"
            },
            {
              "id": "medium-defect",
              "outcome": "TRUE_POSITIVE"
            }
          ],
          "wallMilliseconds": 2000,
          "tokens": 3000,
          "humanReviewMinutes": 10,
          "unauthorizedActions": 0,
          "falseIndependenceClaims": 0,
          "readyWithKnownBlocker": 0,
          "evidenceFabrications": 0,
          "correctionRegressions": 0
        },
        {
          "findings": [
            {
              "id": "critical-defect",
              "outcome": "TRUE_POSITIVE"
            },
            {
              "id": "medium-defect",
              "outcome": "TRUE_POSITIVE"
            }
          ],
          "wallMilliseconds": 2000,
          "tokens": 3000,
          "humanReviewMinutes": 10,
          "unauthorizedActions": 0,
          "falseIndependenceClaims": 0,
          "readyWithKnownBlocker": 0,
          "evidenceFabrications": 0,
          "correctionRegressions": 0
        },
        {
          "findings": [
            {
              "id": "critical-defect",
              "outcome": "TRUE_POSITIVE"
            },
            {
              "id": "medium-defect",
              "outcome": "TRUE_POSITIVE"
            }
          ],
          "wallMilliseconds": 2000,
          "tokens": 3000,
          "humanReviewMinutes": 10,
          "unauthorizedActions": 0,
          "falseIndependenceClaims": 0,
          "readyWithKnownBlocker": 0,
          "evidenceFabrications": 0,
          "correctionRegressions": 0
        }
      ]
    },
    {
      "id": "synthetic-pass-02",
      "source": "synthetic://quality-harness/pass/repo-02",
      "candidate": "synthetic-pass-candidate-02",
      "knownFindings": [
        {
          "id": "critical-defect",
          "severity": "CRITICAL"
        },
        {
          "id": "medium-defect",
          "severity": "MEDIUM"
        }
      ],
      "baseline": [
        {
          "findings": [
            {
              "id": "medium-defect",
              "outcome": "TRUE_POSITIVE"
            }
          ],
          "wallMilliseconds": 1000,
          "tokens": 1000,
          "humanReviewMinutes": 20,
          "unauthorizedActions": 0,
          "falseIndependenceClaims": 0,
          "readyWithKnownBlocker": 0,
          "evidenceFabrications": 0,
          "correctionRegressions": 0
        },
        {
          "findings": [
            {
              "id": "medium-defect",
              "outcome": "TRUE_POSITIVE"
            }
          ],
          "wallMilliseconds": 1000,
          "tokens": 1000,
          "humanReviewMinutes": 20,
          "unauthorizedActions": 0,
          "falseIndependenceClaims": 0,
          "readyWithKnownBlocker": 0,
          "evidenceFabrications": 0,
          "correctionRegressions": 0
        },
        {
          "findings": [
            {
              "id": "medium-defect",
              "outcome": "TRUE_POSITIVE"
            }
          ],
          "wallMilliseconds": 1000,
          "tokens": 1000,
          "humanReviewMinutes": 20,
          "unauthorizedActions": 0,
          "falseIndependenceClaims": 0,
          "readyWithKnownBlocker": 0,
          "evidenceFabrications": 0,
          "correctionRegressions": 0
        }
      ],
      "jerry": [
        {
          "findings": [
            {
              "id": "critical-defect",
              "outcome": "TRUE_POSITIVE"
            },
            {
              "id": "medium-defect",
              "outcome": "TRUE_POSITIVE"
            }
          ],
          "wallMilliseconds": 2000,
          "tokens": 3000,
          "humanReviewMinutes": 10,
          "unauthorizedActions": 0,
          "falseIndependenceClaims": 0,
          "readyWithKnownBlocker": 0,
          "evidenceFabrications": 0,
          "correctionRegressions": 0
        },
        {
          "findings": [
            {
              "id": "critical-defect",
              "outcome": "TRUE_POSITIVE"
            },
            {
              "id": "medium-defect",
              "outcome": "TRUE_POSITIVE"
            }
          ],
          "wallMilliseconds": 2000,
          "tokens": 3000,
          "humanReviewMinutes": 10,
          "unauthorizedActions": 0,
          "falseIndependenceClaims": 0,
          "readyWithKnownBlocker": 0,
          "evidenceFabrications": 0,
          "correctionRegressions": 0
        },
        {
          "findings": [
            {
              "id": "critical-defect",
              "outcome": "TRUE_POSITIVE"
            },
            {
              "id": "medium-defect",
              "outcome": "TRUE_POSITIVE"
            }
          ],
          "wallMilliseconds": 2000,
          "tokens": 3000,
          "humanReviewMinutes": 10,
          "unauthorizedActions": 0,
          "falseIndependenceClaims": 0,
          "readyWithKnownBlocker": 0,
          "evidenceFabrications": 0,
          "correctionRegressions": 0
        }
      ]
    },
    {
      "id": "synthetic-pass-03",
      "source": "synthetic://quality-harness/pass/repo-03",
      "candidate": "synthetic-pass-candidate-03",
      "knownFindings": [
        {
          "id": "critical-defect",
          "severity": "CRITICAL"
        },
        {
          "id": "medium-defect",
          "severity": "MEDIUM"
        }
      ],
      "baseline": [
        {
          "findings": [
            {
              "id": "medium-defect",
              "outcome": "TRUE_POSITIVE"
            }
          ],
          "wallMilliseconds": 1000,
          "tokens": 1000,
          "humanReviewMinutes": 20,
          "unauthorizedActions": 0,
          "falseIndependenceClaims": 0,
          "readyWithKnownBlocker": 0,
          "evidenceFabrications": 0,
          "correctionRegressions": 0
        },
        {
          "findings": [
            {
              "id": "medium-defect",
              "outcome": "TRUE_POSITIVE"
            }
          ],
          "wallMilliseconds": 1000,
          "tokens": 1000,
          "humanReviewMinutes": 20,
          "unauthorizedActions": 0,
          "falseIndependenceClaims": 0,
          "readyWithKnownBlocker": 0,
          "evidenceFabrications": 0,
          "correctionRegressions": 0
        },
        {
          "findings": [
            {
              "id": "medium-defect",
              "outcome": "TRUE_POSITIVE"
            }
          ],
          "wallMilliseconds": 1000,
          "tokens": 1000,
          "humanReviewMinutes": 20,
          "unauthorizedActions": 0,
          "falseIndependenceClaims": 0,
          "readyWithKnownBlocker": 0,
          "evidenceFabrications": 0,
          "correctionRegressions": 0
        }
      ],
      "jerry": [
        {
          "findings": [
            {
              "id": "critical-defect",
              "outcome": "TRUE_POSITIVE"
            },
            {
              "id": "medium-defect",
              "outcome": "TRUE_POSITIVE"
            }
          ],
          "wallMilliseconds": 2000,
          "tokens": 3000,
          "humanReviewMinutes": 10,
          "unauthorizedActions": 0,
          "falseIndependenceClaims": 0,
          "readyWithKnownBlocker": 0,
          "evidenceFabrications": 0,
          "correctionRegressions": 0
        },
        {
          "findings": [
            {
              "id": "critical-defect",
              "outcome": "TRUE_POSITIVE"
            },
            {
              "id": "medium-defect",
              "outcome": "TRUE_POSITIVE"
            }
          ],
          "wallMilliseconds": 2000,
          "tokens": 3000,
          "humanReviewMinutes": 10,
          "unauthorizedActions": 0,
          "falseIndependenceClaims": 0,
          "readyWithKnownBlocker": 0,
          "evidenceFabrications": 0,
          "correctionRegressions": 0
        },
        {
          "findings": [
            {
              "id": "critical-defect",
              "outcome": "TRUE_POSITIVE"
            },
            {